<?xml version="1.0" encoding="UTF-8"?>
<list xmlns:xsi="http://www.w3.org/2001/XMLSchema-instance" xsi:noNamespaceSchemaLocation="../../xsd/buildings.xsd">
    <building id="operation_center" nameId="building_operation_center_n" class="CommonBuilding" descriptionId="building_operation_center_d" maxLevel="10">
        <buildTime>
            <set fromLevel="1" function="Math.pow($level,1.4)*1000*10" />
        </buildTime>
        <requirements>
            <functions>
                <function fromLevel="1" itemId="resource_1" value="0,2*Math.pow($level,4)"/>
                <function fromLevel="1" itemId="resource_2" value="0,2*Math.pow($level,4)"/>
                <function fromLevel="1" itemId="resource_5" value="0,2*Math.pow($level,4)"/>
                <function fromLevel="1" itemId="resource_3" value="0,2*Math.pow($level,4)"/>
            </functions>
        </requirements>
    </building>
</list>