<?xml version="1.0" encoding="UTF-8"?>
<list xmlns:xsi="http://www.w3.org/2001/XMLSchema-instance" xsi:noNamespaceSchemaLocation="../../xsd/buildings.xsd">
    <building id="robot_factory" class="CommonBuilding" nameId="building_robot_factory_n" maxLevel="30" descriptionId="building_robot_factory_d">
        <buildTime>
            <set fromLevel="1" function="1750*$level" />
        </buildTime>
        <stats>
            <stat name="BUILD_COOLDOWN_REDUCTION" function="($level * (0.0085))" op="PER" />
        </stats>
        <requirements>
            <functions>
                <function fromLevel="1" itemId="resource_ch4" value="100*$level"/>
            </functions>
        </requirements>
    </building>
</list>