<?xml version="1.0" encoding="UTF-8"?>
<list xmlns:xsi="http://www.w3.org/2001/XMLSchema-instance" xsi:noNamespaceSchemaLocation="../../xsd/buildings.xsd">
    <building id="market" class="CommonBuilding" nameId="building_market_n" maxLevel="100"
              descriptionId="building_market_d">
        <buildTime>
            <set fromLevel="1" function="Math.pow($level,1.4)*1000*10"/>
        </buildTime>
        <requirements>
            <functions>
                <function fromLevel="1" toLevel="4" itemId="resource_1" value="0,2*Math.pow($level,4)"/>
                <function fromLevel="5" itemId="resource_steel" value="0,2*Math.pow($level,4)"/>
            </functions>
            <requirement level="3">
                <building id="mine" level="1"/>
                <item id="dfd" count="5"/>
            </requirement>
            <requirement level="5">
                <building id="mine" level="2"/>
                <building id="storage" level="2"/>
            </requirement>
        </requirements>
    </building>
</list>